{
  "contract_version": "1.0.0",
  "capability_id": "agt002.analysis.read",
  "correlation_id": "syn-corr-analysis-001",
  "run_id": "syn-run-analysis-001",
  "policy_version": "phase3a-p1-read-only",
  "source": {
    "system": "SIIO",
    "dataset": "psi_sales_interactions:tender_document_analysis",
    "record_set_id": "syn-record-set-analysis-001",
    "persisted": true
  },
  "cutoff_at": "2030-02-01T10:00:00Z",
  "evidence": [
    {
      "evidence_id": "syn-evidence-analysis-001",
      "evidence_type": "record",
      "record_id": "syn-record-analysis-001",
      "captured_at": "2030-02-01T10:00:00Z"
    }
  ],
  "data": {
    "analysis": {
      "opportunity_id": "syn-opportunity-003",
      "status": "analisis_generado",
      "generated_at": "2030-01-31T10:00:00Z",
      "recommendation": "GO condicionado",
      "risk": "Medio",
      "summary": "Synthetic persisted analysis summary.",
      "findings": [
        "Synthetic finding A."
      ],
      "matrix": [
        {
          "category": "Synthetic category",
          "status": "Synthetic status",
          "detail": "Synthetic detail."
        }
      ],
      "next_action": "Synthetic human review step.",
      "human_review_required": true
    }
  }
}
